No.     Time                          Source                Destination           Protocol Length Info
      1 2017-09-14 09:00:58.814238596 172.29.106.52         128.119.245.12        TCP      66     37498 → 80 [FIN, ACK] Seq=1 Ack=1 Win=229 Len=0 TSval=494701 TSecr=2851664118

Frame 1: 66 bytes on wire (528 bits), 66 bytes captured (528 bits) on interface 0
    Interface id: 0 (wlan0)
    Encapsulation type: Ethernet (1)
    Arrival Time: Sep 14, 2017 09:00:58.814238596 BRT
    [Time shift for this packet: 0.000000000 seconds]
    Epoch Time: 1505390458.814238596 seconds
    [Time delta from previous captured frame: 0.000000000 seconds]
    [Time delta from previous displayed frame: 0.000000000 seconds]
    [Time since reference or first frame: 0.000000000 seconds]
    Frame Number: 1
    Frame Length: 66 bytes (528 bits)
    Capture Length: 66 bytes (528 bits)
    [Frame is marked: False]
    [Frame is ignored: False]
    [Protocols in frame: eth:ethertype:ip:tcp]
Ethernet II, Src: IntelCor_b3:f1:c3 (a0:a8:cd:b3:f1:c3), Dst: PaloAlto_00:01:27 (00:1b:17:00:01:27)
    Destination: PaloAlto_00:01:27 (00:1b:17:00:01:27)
        Address: PaloAlto_00:01:27 (00:1b:17:00:01:27)
        .... ..0. .... .... .... .... = LG bit: Globally unique address (factory default)
        .... ...0 .... .... .... .... = IG bit: Individual address (unicast)
    Source: IntelCor_b3:f1:c3 (a0:a8:cd:b3:f1:c3)
        Address: IntelCor_b3:f1:c3 (a0:a8:cd:b3:f1:c3)
        .... ..0. .... .... .... .... = LG bit: Globally unique address (factory default)
        .... ...0 .... .... .... .... = IG bit: Individual address (unicast)
    Type: IPv4 (0x0800)
Internet Protocol Version 4, Src: 172.29.106.52, Dst: 128.119.245.12
    0100 .... = Version: 4
    .... 0101 = Header Length: 20 bytes (5)
    Differentiated Services Field: 0x00 (DSCP: CS0, ECN: Not-ECT)
        0000 00.. = Differentiated Services Codepoint: Default (0)
        .... ..00 = Explicit Congestion Notification: Not ECN-Capable Transport (0)
    Total Length: 52
    Identification: 0x335f (13151)
    Flags: 0x02 (Don't Fragment)
        0... .... = Reserved bit: Not set
        .1.. .... = Don't fragment: Set
        ..0. .... = More fragments: Not set
    Fragment offset: 0
    Time to live: 64
    Protocol: TCP (6)
    Header checksum: 0x7b8f [validation disabled]
    [Header checksum status: Unverified]
    Source: 172.29.106.52
    Destination: 128.119.245.12
    [Source GeoIP: Unknown]
    [Destination GeoIP: United States]
        [Destination GeoIP Country: United States]
Transmission Control Protocol, Src Port: 37498, Dst Port: 80, Seq: 1, Ack: 1, Len: 0
    Source Port: 37498
    Destination Port: 80
    [Stream index: 0]
    [TCP Segment Len: 0]
    Sequence number: 1    (relative sequence number)
    Acknowledgment number: 1    (relative ack number)
    Header Length: 32 bytes
    Flags: 0x011 (FIN, ACK)
        000. .... .... = Reserved: Not set
        ...0 .... .... = Nonce: Not set
        .... 0... .... = Congestion Window Reduced (CWR): Not set
        .... .0.. .... = ECN-Echo: Not set
        .... ..0. .... = Urgent: Not set
        .... ...1 .... = Acknowledgment: Set
        .... .... 0... = Push: Not set
        .... .... .0.. = Reset: Not set
        .... .... ..0. = Syn: Not set
        .... .... ...1 = Fin: Set
            [Expert Info (Chat/Sequence): Connection finish (FIN)]
                [Connection finish (FIN)]
                [Severity level: Chat]
                [Group: Sequence]
        [TCP Flags: ·······A···F]
    Window size value: 229
    [Calculated window size: 229]
    [Window size scaling factor: -1 (unknown)]
    Checksum: 0x52af [unverified]
    [Checksum Status: Unverified]
    Urgent pointer: 0
    Options: (12 bytes), No-Operation (NOP), No-Operation (NOP), Timestamps
        No-Operation (NOP)
            Type: 1
                0... .... = Copy on fragmentation: No
                .00. .... = Class: Control (0)
                ...0 0001 = Number: No-Operation (NOP) (1)
        No-Operation (NOP)
            Type: 1
                0... .... = Copy on fragmentation: No
                .00. .... = Class: Control (0)
                ...0 0001 = Number: No-Operation (NOP) (1)
        Timestamps: TSval 494701, TSecr 2851664118
            Kind: Time Stamp Option (8)
            Length: 10
            Timestamp value: 494701
            Timestamp echo reply: 2851664118

No.     Time                          Source                Destination           Protocol Length Info
      2 2017-09-14 09:00:58.814266305 172.29.106.52         128.119.245.12        TCP      66     37496 → 80 [FIN, ACK] Seq=1 Ack=1 Win=237 Len=0 TSval=494701 TSecr=2851623956

Frame 2: 66 bytes on wire (528 bits), 66 bytes captured (528 bits) on interface 0
    Interface id: 0 (wlan0)
    Encapsulation type: Ethernet (1)
    Arrival Time: Sep 14, 2017 09:00:58.814266305 BRT
    [Time shift for this packet: 0.000000000 seconds]
    Epoch Time: 1505390458.814266305 seconds
    [Time delta from previous captured frame: 0.000027709 seconds]
    [Time delta from previous displayed frame: 0.000000000 seconds]
    [Time since reference or first frame: 0.000027709 seconds]
    Frame Number: 2
    Frame Length: 66 bytes (528 bits)
    Capture Length: 66 bytes (528 bits)
    [Frame is marked: False]
    [Frame is ignored: False]
    [Protocols in frame: eth:ethertype:ip:tcp]
Ethernet II, Src: IntelCor_b3:f1:c3 (a0:a8:cd:b3:f1:c3), Dst: PaloAlto_00:01:27 (00:1b:17:00:01:27)
    Destination: PaloAlto_00:01:27 (00:1b:17:00:01:27)
        Address: PaloAlto_00:01:27 (00:1b:17:00:01:27)
        .... ..0. .... .... .... .... = LG bit: Globally unique address (factory default)
        .... ...0 .... .... .... .... = IG bit: Individual address (unicast)
    Source: IntelCor_b3:f1:c3 (a0:a8:cd:b3:f1:c3)
        Address: IntelCor_b3:f1:c3 (a0:a8:cd:b3:f1:c3)
        .... ..0. .... .... .... .... = LG bit: Globally unique address (factory default)
        .... ...0 .... .... .... .... = IG bit: Individual address (unicast)
    Type: IPv4 (0x0800)
Internet Protocol Version 4, Src: 172.29.106.52, Dst: 128.119.245.12
    0100 .... = Version: 4
    .... 0101 = Header Length: 20 bytes (5)
    Differentiated Services Field: 0x00 (DSCP: CS0, ECN: Not-ECT)
        0000 00.. = Differentiated Services Codepoint: Default (0)
        .... ..00 = Explicit Congestion Notification: Not ECN-Capable Transport (0)
    Total Length: 52
    Identification: 0x4ad8 (19160)
    Flags: 0x02 (Don't Fragment)
        0... .... = Reserved bit: Not set
        .1.. .... = Don't fragment: Set
        ..0. .... = More fragments: Not set
    Fragment offset: 0
    Time to live: 64
    Protocol: TCP (6)
    Header checksum: 0x6416 [validation disabled]
    [Header checksum status: Unverified]
    Source: 172.29.106.52
    Destination: 128.119.245.12
    [Source GeoIP: Unknown]
    [Destination GeoIP: United States]
        [Destination GeoIP Country: United States]
Transmission Control Protocol, Src Port: 37496, Dst Port: 80, Seq: 1, Ack: 1, Len: 0
    Source Port: 37496
    Destination Port: 80
    [Stream index: 1]
    [TCP Segment Len: 0]
    Sequence number: 1    (relative sequence number)
    Acknowledgment number: 1    (relative ack number)
    Header Length: 32 bytes
    Flags: 0x011 (FIN, ACK)
        000. .... .... = Reserved: Not set
        ...0 .... .... = Nonce: Not set
        .... 0... .... = Congestion Window Reduced (CWR): Not set
        .... .0.. .... = ECN-Echo: Not set
        .... ..0. .... = Urgent: Not set
        .... ...1 .... = Acknowledgment: Set
        .... .... 0... = Push: Not set
        .... .... .0.. = Reset: Not set
        .... .... ..0. = Syn: Not set
        .... .... ...1 = Fin: Set
            [Expert Info (Chat/Sequence): Connection finish (FIN)]
                [Connection finish (FIN)]
                [Severity level: Chat]
                [Group: Sequence]
        [TCP Flags: ·······A···F]
    Window size value: 237
    [Calculated window size: 237]
    [Window size scaling factor: -1 (unknown)]
    Checksum: 0x136b [unverified]
    [Checksum Status: Unverified]
    Urgent pointer: 0
    Options: (12 bytes), No-Operation (NOP), No-Operation (NOP), Timestamps
        No-Operation (NOP)
            Type: 1
                0... .... = Copy on fragmentation: No
                .00. .... = Class: Control (0)
                ...0 0001 = Number: No-Operation (NOP) (1)
        No-Operation (NOP)
            Type: 1
                0... .... = Copy on fragmentation: No
                .00. .... = Class: Control (0)
                ...0 0001 = Number: No-Operation (NOP) (1)
        Timestamps: TSval 494701, TSecr 2851623956
            Kind: Time Stamp Option (8)
            Length: 10
            Timestamp value: 494701
            Timestamp echo reply: 2851623956

No.     Time                          Source                Destination           Protocol Length Info
      3 2017-09-14 09:00:58.814333403 172.29.106.52         128.119.245.12        TCP      74     37500 → 80 [SYN] Seq=0 Win=29200 Len=0 MSS=1460 SACK_PERM=1 TSval=494701 TSecr=0 WS=128

Frame 3: 74 bytes on wire (592 bits), 74 bytes captured (592 bits) on interface 0
    Interface id: 0 (wlan0)
    Encapsulation type: Ethernet (1)
    Arrival Time: Sep 14, 2017 09:00:58.814333403 BRT
    [Time shift for this packet: 0.000000000 seconds]
    Epoch Time: 1505390458.814333403 seconds
    [Time delta from previous captured frame: 0.000067098 seconds]
    [Time delta from previous displayed frame: 0.000000000 seconds]
    [Time since reference or first frame: 0.000094807 seconds]
    Frame Number: 3
    Frame Length: 74 bytes (592 bits)
    Capture Length: 74 bytes (592 bits)
    [Frame is marked: False]
    [Frame is ignored: False]
    [Protocols in frame: eth:ethertype:ip:tcp]
Ethernet II, Src: IntelCor_b3:f1:c3 (a0:a8:cd:b3:f1:c3), Dst: PaloAlto_00:01:27 (00:1b:17:00:01:27)
    Destination: PaloAlto_00:01:27 (00:1b:17:00:01:27)
        Address: PaloAlto_00:01:27 (00:1b:17:00:01:27)
        .... ..0. .... .... .... .... = LG bit: Globally unique address (factory default)
        .... ...0 .... .... .... .... = IG bit: Individual address (unicast)
    Source: IntelCor_b3:f1:c3 (a0:a8:cd:b3:f1:c3)
        Address: IntelCor_b3:f1:c3 (a0:a8:cd:b3:f1:c3)
        .... ..0. .... .... .... .... = LG bit: Globally unique address (factory default)
        .... ...0 .... .... .... .... = IG bit: Individual address (unicast)
    Type: IPv4 (0x0800)
Internet Protocol Version 4, Src: 172.29.106.52, Dst: 128.119.245.12
    0100 .... = Version: 4
    .... 0101 = Header Length: 20 bytes (5)
    Differentiated Services Field: 0x00 (DSCP: CS0, ECN: Not-ECT)
        0000 00.. = Differentiated Services Codepoint: Default (0)
        .... ..00 = Explicit Congestion Notification: Not ECN-Capable Transport (0)
    Total Length: 60
    Identification: 0xf092 (61586)
    Flags: 0x02 (Don't Fragment)
        0... .... = Reserved bit: Not set
        .1.. .... = Don't fragment: Set
        ..0. .... = More fragments: Not set
    Fragment offset: 0
    Time to live: 64
    Protocol: TCP (6)
    Header checksum: 0xbe53 [validation disabled]
    [Header checksum status: Unverified]
    Source: 172.29.106.52
    Destination: 128.119.245.12
    [Source GeoIP: Unknown]
    [Destination GeoIP: United States]
        [Destination GeoIP Country: United States]
Transmission Control Protocol, Src Port: 37500, Dst Port: 80, Seq: 0, Len: 0
    Source Port: 37500
    Destination Port: 80
    [Stream index: 2]
    [TCP Segment Len: 0]
    Sequence number: 0    (relative sequence number)
    Acknowledgment number: 0
    Header Length: 40 bytes
    Flags: 0x002 (SYN)
        000. .... .... = Reserved: Not set
        ...0 .... .... = Nonce: Not set
        .... 0... .... = Congestion Window Reduced (CWR): Not set
        .... .0.. .... = ECN-Echo: Not set
        .... ..0. .... = Urgent: Not set
        .... ...0 .... = Acknowledgment: Not set
        .... .... 0... = Push: Not set
        .... .... .0.. = Reset: Not set
        .... .... ..1. = Syn: Set
            [Expert Info (Chat/Sequence): Connection establish request (SYN): server port 80]
                [Connection establish request (SYN): server port 80]
                [Severity level: Chat]
                [Group: Sequence]
        .... .... ...0 = Fin: Not set
        [TCP Flags: ··········S·]
    Window size value: 29200
    [Calculated window size: 29200]
    Checksum: 0x8e95 [unverified]
    [Checksum Status: Unverified]
    Urgent pointer: 0
    Options: (20 bytes), Maximum segment size, SACK permitted, Timestamps, No-Operation (NOP), Window scale
        Maximum segment size: 1460 bytes
            Kind: Maximum Segment Size (2)
            Length: 4
            MSS Value: 1460
        TCP SACK Permitted Option: True
            Kind: SACK Permitted (4)
            Length: 2
        Timestamps: TSval 494701, TSecr 0
            Kind: Time Stamp Option (8)
            Length: 10
            Timestamp value: 494701
            Timestamp echo reply: 0
        No-Operation (NOP)
            Type: 1
                0... .... = Copy on fragmentation: No
                .00. .... = Class: Control (0)
                ...0 0001 = Number: No-Operation (NOP) (1)
        Window scale: 7 (multiply by 128)
            Kind: Window Scale (3)
            Length: 3
            Shift count: 7
            [Multiplier: 128]

No.     Time                          Source                Destination           Protocol Length Info
      4 2017-09-14 09:00:58.814401714 172.29.106.52         128.119.245.12        TCP      74     37502 → 80 [SYN] Seq=0 Win=29200 Len=0 MSS=1460 SACK_PERM=1 TSval=494701 TSecr=0 WS=128

Frame 4: 74 bytes on wire (592 bits), 74 bytes captured (592 bits) on interface 0
    Interface id: 0 (wlan0)
    Encapsulation type: Ethernet (1)
    Arrival Time: Sep 14, 2017 09:00:58.814401714 BRT
    [Time shift for this packet: 0.000000000 seconds]
    Epoch Time: 1505390458.814401714 seconds
    [Time delta from previous captured frame: 0.000068311 seconds]
    [Time delta from previous displayed frame: 0.000000000 seconds]
    [Time since reference or first frame: 0.000163118 seconds]
    Frame Number: 4
    Frame Length: 74 bytes (592 bits)
    Capture Length: 74 bytes (592 bits)
    [Frame is marked: False]
    [Frame is ignored: False]
    [Protocols in frame: eth:ethertype:ip:tcp]
Ethernet II, Src: IntelCor_b3:f1:c3 (a0:a8:cd:b3:f1:c3), Dst: PaloAlto_00:01:27 (00:1b:17:00:01:27)
    Destination: PaloAlto_00:01:27 (00:1b:17:00:01:27)
        Address: PaloAlto_00:01:27 (00:1b:17:00:01:27)
        .... ..0. .... .... .... .... = LG bit: Globally unique address (factory default)
        .... ...0 .... .... .... .... = IG bit: Individual address (unicast)
    Source: IntelCor_b3:f1:c3 (a0:a8:cd:b3:f1:c3)
        Address: IntelCor_b3:f1:c3 (a0:a8:cd:b3:f1:c3)
        .... ..0. .... .... .... .... = LG bit: Globally unique address (factory default)
        .... ...0 .... .... .... .... = IG bit: Individual address (unicast)
    Type: IPv4 (0x0800)
Internet Protocol Version 4, Src: 172.29.106.52, Dst: 128.119.245.12
    0100 .... = Version: 4
    .... 0101 = Header Length: 20 bytes (5)
    Differentiated Services Field: 0x00 (DSCP: CS0, ECN: Not-ECT)
        0000 00.. = Differentiated Services Codepoint: Default (0)
        .... ..00 = Explicit Congestion Notification: Not ECN-Capable Transport (0)
    Total Length: 60
    Identification: 0x8a23 (35363)
    Flags: 0x02 (Don't Fragment)
        0... .... = Reserved bit: Not set
        .1.. .... = Don't fragment: Set
        ..0. .... = More fragments: Not set
    Fragment offset: 0
    Time to live: 64
    Protocol: TCP (6)
    Header checksum: 0x24c3 [validation disabled]
    [Header checksum status: Unverified]
    Source: 172.29.106.52
    Destination: 128.119.245.12
    [Source GeoIP: Unknown]
    [Destination GeoIP: United States]
        [Destination GeoIP Country: United States]
Transmission Control Protocol, Src Port: 37502, Dst Port: 80, Seq: 0, Len: 0
    Source Port: 37502
    Destination Port: 80
    [Stream index: 3]
    [TCP Segment Len: 0]
    Sequence number: 0    (relative sequence number)
    Acknowledgment number: 0
    Header Length: 40 bytes
    Flags: 0x002 (SYN)
        000. .... .... = Reserved: Not set
        ...0 .... .... = Nonce: Not set
        .... 0... .... = Congestion Window Reduced (CWR): Not set
        .... .0.. .... = ECN-Echo: Not set
        .... ..0. .... = Urgent: Not set
        .... ...0 .... = Acknowledgment: Not set
        .... .... 0... = Push: Not set
        .... .... .0.. = Reset: Not set
        .... .... ..1. = Syn: Set
            [Expert Info (Chat/Sequence): Connection establish request (SYN): server port 80]
                [Connection establish request (SYN): server port 80]
                [Severity level: Chat]
                [Group: Sequence]
        .... .... ...0 = Fin: Not set
        [TCP Flags: ··········S·]
    Window size value: 29200
    [Calculated window size: 29200]
    Checksum: 0x367b [unverified]
    [Checksum Status: Unverified]
    Urgent pointer: 0
    Options: (20 bytes), Maximum segment size, SACK permitted, Timestamps, No-Operation (NOP), Window scale
        Maximum segment size: 1460 bytes
            Kind: Maximum Segment Size (2)
            Length: 4
            MSS Value: 1460
        TCP SACK Permitted Option: True
            Kind: SACK Permitted (4)
            Length: 2
        Timestamps: TSval 494701, TSecr 0
            Kind: Time Stamp Option (8)
            Length: 10
            Timestamp value: 494701
            Timestamp echo reply: 0
        No-Operation (NOP)
            Type: 1
                0... .... = Copy on fragmentation: No
                .00. .... = Class: Control (0)
                ...0 0001 = Number: No-Operation (NOP) (1)
        Window scale: 7 (multiply by 128)
            Kind: Window Scale (3)
            Length: 3
            Shift count: 7
            [Multiplier: 128]

No.     Time                          Source                Destination           Protocol Length Info
      5 2017-09-14 09:00:59.064874762 172.29.106.52         164.41.101.11         DNS      77     Standard query 0xacfe A gaia.cs.umass.edu

Frame 5: 77 bytes on wire (616 bits), 77 bytes captured (616 bits) on interface 0
    Interface id: 0 (wlan0)
    Encapsulation type: Ethernet (1)
    Arrival Time: Sep 14, 2017 09:00:59.064874762 BRT
    [Time shift for this packet: 0.000000000 seconds]
    Epoch Time: 1505390459.064874762 seconds
    [Time delta from previous captured frame: 0.250473048 seconds]
    [Time delta from previous displayed frame: 0.000000000 seconds]
    [Time since reference or first frame: 0.250636166 seconds]
    Frame Number: 5
    Frame Length: 77 bytes (616 bits)
    Capture Length: 77 bytes (616 bits)
    [Frame is marked: False]
    [Frame is ignored: False]
    [Protocols in frame: eth:ethertype:ip:udp:dns]
Ethernet II, Src: IntelCor_b3:f1:c3 (a0:a8:cd:b3:f1:c3), Dst: PaloAlto_00:01:27 (00:1b:17:00:01:27)
    Destination: PaloAlto_00:01:27 (00:1b:17:00:01:27)
        Address: PaloAlto_00:01:27 (00:1b:17:00:01:27)
        .... ..0. .... .... .... .... = LG bit: Globally unique address (factory default)
        .... ...0 .... .... .... .... = IG bit: Individual address (unicast)
    Source: IntelCor_b3:f1:c3 (a0:a8:cd:b3:f1:c3)
        Address: IntelCor_b3:f1:c3 (a0:a8:cd:b3:f1:c3)
        .... ..0. .... .... .... .... = LG bit: Globally unique address (factory default)
        .... ...0 .... .... .... .... = IG bit: Individual address (unicast)
    Type: IPv4 (0x0800)
Internet Protocol Version 4, Src: 172.29.106.52, Dst: 164.41.101.11
    0100 .... = Version: 4
    .... 0101 = Header Length: 20 bytes (5)
    Differentiated Services Field: 0x00 (DSCP: CS0, ECN: Not-ECT)
        0000 00.. = Differentiated Services Codepoint: Default (0)
        .... ..00 = Explicit Congestion Notification: Not ECN-Capable Transport (0)
    Total Length: 63
    Identification: 0x0769 (1897)
    Flags: 0x02 (Don't Fragment)
        0... .... = Reserved bit: Not set
        .1.. .... = Don't fragment: Set
        ..0. .... = More fragments: Not set
    Fragment offset: 0
    Time to live: 64
    Protocol: UDP (17)
    Header checksum: 0x13bf [validation disabled]
    [Header checksum status: Unverified]
    Source: 172.29.106.52
    Destination: 164.41.101.11
    [Source GeoIP: Unknown]
    [Destination GeoIP: Brazil]
        [Destination GeoIP Country: Brazil]
User Datagram Protocol, Src Port: 24109, Dst Port: 53
    Source Port: 24109
    Destination Port: 53
    Length: 43
    Checksum: 0x5945 [unverified]
    [Checksum Status: Unverified]
    [Stream index: 0]
Domain Name System (query)
    [Response In: 15]
    Transaction ID: 0xacfe
    Flags: 0x0100 Standard query
        0... .... .... .... = Response: Message is a query
        .000 0... .... .... = Opcode: Standard query (0)
        .... ..0. .... .... = Truncated: Message is not truncated
        .... ...1 .... .... = Recursion desired: Do query recursively
        .... .... .0.. .... = Z: reserved (0)
        .... .... ...0 .... = Non-authenticated data: Unacceptable
    Questions: 1
    Answer RRs: 0
    Authority RRs: 0
    Additional RRs: 0
    Queries
        gaia.cs.umass.edu: type A, class IN
            Name: gaia.cs.umass.edu
            [Name Length: 17]
            [Label Count: 4]
            Type: A (Host Address) (1)
            Class: IN (0x0001)

No.     Time                          Source                Destination           Protocol Length Info
      6 2017-09-14 09:00:59.064890764 172.29.106.52         164.41.101.4          DNS      77     Standard query 0xacfe A gaia.cs.umass.edu

Frame 6: 77 bytes on wire (616 bits), 77 bytes captured (616 bits) on interface 0
    Interface id: 0 (wlan0)
    Encapsulation type: Ethernet (1)
    Arrival Time: Sep 14, 2017 09:00:59.064890764 BRT
    [Time shift for this packet: 0.000000000 seconds]
    Epoch Time: 1505390459.064890764 seconds
    [Time delta from previous captured frame: 0.000016002 seconds]
    [Time delta from previous displayed frame: 0.000000000 seconds]
    [Time since reference or first frame: 0.250652168 seconds]
    Frame Number: 6
    Frame Length: 77 bytes (616 bits)
    Capture Length: 77 bytes (616 bits)
    [Frame is marked: False]
    [Frame is ignored: False]
    [Protocols in frame: eth:ethertype:ip:udp:dns]
Ethernet II, Src: IntelCor_b3:f1:c3 (a0:a8:cd:b3:f1:c3), Dst: PaloAlto_00:01:27 (00:1b:17:00:01:27)
    Destination: PaloAlto_00:01:27 (00:1b:17:00:01:27)
        Address: PaloAlto_00:01:27 (00:1b:17:00:01:27)
        .... ..0. .... .... .... .... = LG bit: Globally unique address (factory default)
        .... ...0 .... .... .... .... = IG bit: Individual address (unicast)
    Source: IntelCor_b3:f1:c3 (a0:a8:cd:b3:f1:c3)
        Address: IntelCor_b3:f1:c3 (a0:a8:cd:b3:f1:c3)
        .... ..0. .... .... .... .... = LG bit: Globally unique address (factory default)
        .... ...0 .... .... .... .... = IG bit: Individual address (unicast)
    Type: IPv4 (0x0800)
Internet Protocol Version 4, Src: 172.29.106.52, Dst: 164.41.101.4
    0100 .... = Version: 4
    .... 0101 = Header Length: 20 bytes (5)
    Differentiated Services Field: 0x00 (DSCP: CS0, ECN: Not-ECT)
        0000 00.. = Differentiated Services Codepoint: Default (0)
        .... ..00 = Explicit Congestion Notification: Not ECN-Capable Transport (0)
    Total Length: 63
    Identification: 0x8ca9 (36009)
    Flags: 0x02 (Don't Fragment)
        0... .... = Reserved bit: Not set
        .1.. .... = Don't fragment: Set
        ..0. .... = More fragments: Not set
    Fragment offset: 0
    Time to live: 64
    Protocol: UDP (17)
    Header checksum: 0x8e85 [validation disabled]
    [Header checksum status: Unverified]
    Source: 172.29.106.52
    Destination: 164.41.101.4
    [Source GeoIP: Unknown]
    [Destination GeoIP: Brazil]
        [Destination GeoIP Country: Brazil]
User Datagram Protocol, Src Port: 24109, Dst Port: 53
    Source Port: 24109
    Destination Port: 53
    Length: 43
    Checksum: 0x594c [unverified]
    [Checksum Status: Unverified]
    [Stream index: 1]
Domain Name System (query)
    [Response In: 16]
    Transaction ID: 0xacfe
    Flags: 0x0100 Standard query
        0... .... .... .... = Response: Message is a query
        .000 0... .... .... = Opcode: Standard query (0)
        .... ..0. .... .... = Truncated: Message is not truncated
        .... ...1 .... .... = Recursion desired: Do query recursively
        .... .... .0.. .... = Z: reserved (0)
        .... .... ...0 .... = Non-authenticated data: Unacceptable
    Questions: 1
    Answer RRs: 0
    Authority RRs: 0
    Additional RRs: 0
    Queries
        gaia.cs.umass.edu: type A, class IN
            Name: gaia.cs.umass.edu
            [Name Length: 17]
            [Label Count: 4]
            Type: A (Host Address) (1)
            Class: IN (0x0001)

No.     Time                          Source                Destination           Protocol Length Info
      7 2017-09-14 09:00:59.081011400 128.119.245.12        172.29.106.52         TCP      66     80 → 37496 [ACK] Seq=1 Ack=2 Win=235 Len=0 TSval=2851667112 TSecr=494701

Frame 7: 66 bytes on wire (528 bits), 66 bytes captured (528 bits) on interface 0
    Interface id: 0 (wlan0)
    Encapsulation type: Ethernet (1)
    Arrival Time: Sep 14, 2017 09:00:59.081011400 BRT
    [Time shift for this packet: 0.000000000 seconds]
    Epoch Time: 1505390459.081011400 seconds
    [Time delta from previous captured frame: 0.016120636 seconds]
    [Time delta from previous displayed frame: 0.000000000 seconds]
    [Time since reference or first frame: 0.266772804 seconds]
    Frame Number: 7
    Frame Length: 66 bytes (528 bits)
    Capture Length: 66 bytes (528 bits)
    [Frame is marked: False]
    [Frame is ignored: False]
    [Protocols in frame: eth:ethertype:ip:tcp]
Ethernet II, Src: PaloAlto_00:01:27 (00:1b:17:00:01:27), Dst: IntelCor_b3:f1:c3 (a0:a8:cd:b3:f1:c3)
    Destination: IntelCor_b3:f1:c3 (a0:a8:cd:b3:f1:c3)
        Address: IntelCor_b3:f1:c3 (a0:a8:cd:b3:f1:c3)
        .... ..0. .... .... .... .... = LG bit: Globally unique address (factory default)
        .... ...0 .... .... .... .... = IG bit: Individual address (unicast)
    Source: PaloAlto_00:01:27 (00:1b:17:00:01:27)
        Address: PaloAlto_00:01:27 (00:1b:17:00:01:27)
        .... ..0. .... .... .... .... = LG bit: Globally unique address (factory default)
        .... ...0 .... .... .... .... = IG bit: Individual address (unicast)
    Type: IPv4 (0x0800)
Internet Protocol Version 4, Src: 128.119.245.12, Dst: 172.29.106.52
    0100 .... = Version: 4
    .... 0101 = Header Length: 20 bytes (5)
    Differentiated Services Field: 0x00 (DSCP: CS0, ECN: Not-ECT)
        0000 00.. = Differentiated Services Codepoint: Default (0)
        .... ..00 = Explicit Congestion Notification: Not ECN-Capable Transport (0)
    Total Length: 52
    Identification: 0x77c9 (30665)
    Flags: 0x02 (Don't Fragment)
        0... .... = Reserved bit: Not set
        .1.. .... = Don't fragment: Set
        ..0. .... = More fragments: Not set
    Fragment offset: 0
    Time to live: 47
    Protocol: TCP (6)
    Header checksum: 0x4825 [validation disabled]
    [Header checksum status: Unverified]
    Source: 128.119.245.12
    Destination: 172.29.106.52
    [Source GeoIP: United States]
        [Source GeoIP Country: United States]
    [Destination GeoIP: Unknown]
Transmission Control Protocol, Src Port: 80, Dst Port: 37496, Seq: 1, Ack: 2, Len: 0
    Source Port: 80
    Destination Port: 37496
    [Stream index: 1]
    [TCP Segment Len: 0]
    Sequence number: 1    (relative sequence number)
    Acknowledgment number: 2    (relative ack number)
    Header Length: 32 bytes
    Flags: 0x010 (ACK)
        000. .... .... = Reserved: Not set
        ...0 .... .... = Nonce: Not set
        .... 0... .... = Congestion Window Reduced (CWR): Not set
        .... .0.. .... = ECN-Echo: Not set
        .... ..0. .... = Urgent: Not set
        .... ...1 .... = Acknowledgment: Set
        .... .... 0... = Push: Not set
        .... .... .0.. = Reset: Not set
        .... .... ..0. = Syn: Not set
        .... .... ...0 = Fin: Not set
        [TCP Flags: ·······A····]
    Window size value: 235
    [Calculated window size: 235]
    [Window size scaling factor: -1 (unknown)]
    Checksum: 0x6ad8 [unverified]
    [Checksum Status: Unverified]
    Urgent pointer: 0
    Options: (12 bytes), No-Operation (NOP), No-Operation (NOP), Timestamps
        No-Operation (NOP)
            Type: 1
                0... .... = Copy on fragmentation: No
                .00. .... = Class: Control (0)
                ...0 0001 = Number: No-Operation (NOP) (1)
        No-Operation (NOP)
            Type: 1
                0... .... = Copy on fragmentation: No
                .00. .... = Class: Control (0)
                ...0 0001 = Number: No-Operation (NOP) (1)
        Timestamps: TSval 2851667112, TSecr 494701
            Kind: Time Stamp Option (8)
            Length: 10
            Timestamp value: 2851667112
            Timestamp echo reply: 494701
    [SEQ/ACK analysis]
        [This is an ACK to the segment in frame: 2]
        [The RTT to ACK the segment was: 0.266745095 seconds]

No.     Time                          Source                Destination           Protocol Length Info
      8 2017-09-14 09:00:59.094095504 128.119.245.12        172.29.106.52         TCP      74     80 → 37502 [SYN, ACK] Seq=0 Ack=1 Win=28960 Len=0 MSS=1386 SACK_PERM=1 TSval=2851667115 TSecr=494701 WS=128

Frame 8: 74 bytes on wire (592 bits), 74 bytes captured (592 bits) on interface 0
    Interface id: 0 (wlan0)
    Encapsulation type: Ethernet (1)
    Arrival Time: Sep 14, 2017 09:00:59.094095504 BRT
    [Time shift for this packet: 0.000000000 seconds]
    Epoch Time: 1505390459.094095504 seconds
    [Time delta from previous captured frame: 0.013084104 seconds]
    [Time delta from previous displayed frame: 0.000000000 seconds]
    [Time since reference or first frame: 0.279856908 seconds]
    Frame Number: 8
    Frame Length: 74 bytes (592 bits)
    Capture Length: 74 bytes (592 bits)
    [Frame is marked: False]
    [Frame is ignored: False]
    [Protocols in frame: eth:ethertype:ip:tcp]
Ethernet II, Src: PaloAlto_00:01:27 (00:1b:17:00:01:27), Dst: IntelCor_b3:f1:c3 (a0:a8:cd:b3:f1:c3)
    Destination: IntelCor_b3:f1:c3 (a0:a8:cd:b3:f1:c3)
        Address: IntelCor_b3:f1:c3 (a0:a8:cd:b3:f1:c3)
        .... ..0. .... .... .... .... = LG bit: Globally unique address (factory default)
        .... ...0 .... .... .... .... = IG bit: Individual address (unicast)
    Source: PaloAlto_00:01:27 (00:1b:17:00:01:27)
        Address: PaloAlto_00:01:27 (00:1b:17:00:01:27)
        .... ..0. .... .... .... .... = LG bit: Globally unique address (factory default)
        .... ...0 .... .... .... .... = IG bit: Individual address (unicast)
    Type: IPv4 (0x0800)
Internet Protocol Version 4, Src: 128.119.245.12, Dst: 172.29.106.52
    0100 .... = Version: 4
    .... 0101 = Header Length: 20 bytes (5)
    Differentiated Services Field: 0x00 (DSCP: CS0, ECN: Not-ECT)
        0000 00.. = Differentiated Services Codepoint: Default (0)
        .... ..00 = Explicit Congestion Notification: Not ECN-Capable Transport (0)
    Total Length: 60
    Identification: 0x0000 (0)
    Flags: 0x02 (Don't Fragment)
        0... .... = Reserved bit: Not set
        .1.. .... = Don't fragment: Set
        ..0. .... = More fragments: Not set
    Fragment offset: 0
    Time to live: 47
    Protocol: TCP (6)
    Header checksum: 0xbfe6 [validation disabled]
    [Header checksum status: Unverified]
    Source: 128.119.245.12
    Destination: 172.29.106.52
    [Source GeoIP: United States]
        [Source GeoIP Country: United States]
    [Destination GeoIP: Unknown]
Transmission Control Protocol, Src Port: 80, Dst Port: 37502, Seq: 0, Ack: 1, Len: 0
    Source Port: 80
    Destination Port: 37502
    [Stream index: 3]
    [TCP Segment Len: 0]
    Sequence number: 0    (relative sequence number)
    Acknowledgment number: 1    (relative ack number)
    Header Length: 40 bytes
    Flags: 0x012 (SYN, ACK)
        000. .... .... = Reserved: Not set
        ...0 .... .... = Nonce: Not set
        .... 0... .... = Congestion Window Reduced (CWR): Not set
        .... .0.. .... = ECN-Echo: Not set
        .... ..0. .... = Urgent: Not set
        .... ...1 .... = Acknowledgment: Set
        .... .... 0... = Push: Not set
        .... .... .0.. = Reset: Not set
        .... .... ..1. = Syn: Set
            [Expert Info (Chat/Sequence): Connection establish acknowledge (SYN+ACK): server port 80]
                [Connection establish acknowledge (SYN+ACK): server port 80]
                [Severity level: Chat]
                [Group: Sequence]
        .... .... ...0 = Fin: Not set
        [TCP Flags: ·······A··S·]
    Window size value: 28960
    [Calculated window size: 28960]
    Checksum: 0x9524 [unverified]
    [Checksum Status: Unverified]
    Urgent pointer: 0
    Options: (20 bytes), Maximum segment size, SACK permitted, Timestamps, No-Operation (NOP), Window scale
        Maximum segment size: 1386 bytes
            Kind: Maximum Segment Size (2)
            Length: 4
            MSS Value: 1386
        TCP SACK Permitted Option: True
            Kind: SACK Permitted (4)
            Length: 2
        Timestamps: TSval 2851667115, TSecr 494701
            Kind: Time Stamp Option (8)
            Length: 10
            Timestamp value: 2851667115
            Timestamp echo reply: 494701
        No-Operation (NOP)
            Type: 1
                0... .... = Copy on fragmentation: No
                .00. .... = Class: Control (0)
                ...0 0001 = Number: No-Operation (NOP) (1)
        Window scale: 7 (multiply by 128)
            Kind: Window Scale (3)
            Length: 3
            Shift count: 7
            [Multiplier: 128]
    [SEQ/ACK analysis]
        [This is an ACK to the segment in frame: 4]
        [The RTT to ACK the segment was: 0.279693790 seconds]
        [iRTT: 0.279732783 seconds]

No.     Time                          Source                Destination           Protocol Length Info
      9 2017-09-14 09:00:59.094134497 172.29.106.52         128.119.245.12        TCP      66     37502 → 80 [ACK] Seq=1 Ack=1 Win=29312 Len=0 TSval=494771 TSecr=2851667115

Frame 9: 66 bytes on wire (528 bits), 66 bytes captured (528 bits) on interface 0
    Interface id: 0 (wlan0)
    Encapsulation type: Ethernet (1)
    Arrival Time: Sep 14, 2017 09:00:59.094134497 BRT
    [Time shift for this packet: 0.000000000 seconds]
    Epoch Time: 1505390459.094134497 seconds
    [Time delta from previous captured frame: 0.000038993 seconds]
    [Time delta from previous displayed frame: 0.000000000 seconds]
    [Time since reference or first frame: 0.279895901 seconds]
    Frame Number: 9
    Frame Length: 66 bytes (528 bits)
    Capture Length: 66 bytes (528 bits)
    [Frame is marked: False]
    [Frame is ignored: False]
    [Protocols in frame: eth:ethertype:ip:tcp]
Ethernet II, Src: IntelCor_b3:f1:c3 (a0:a8:cd:b3:f1:c3), Dst: PaloAlto_00:01:27 (00:1b:17:00:01:27)
    Destination: PaloAlto_00:01:27 (00:1b:17:00:01:27)
        Address: PaloAlto_00:01:27 (00:1b:17:00:01:27)
        .... ..0. .... .... .... .... = LG bit: Globally unique address (factory default)
        .... ...0 .... .... .... .... = IG bit: Individual address (unicast)
    Source: IntelCor_b3:f1:c3 (a0:a8:cd:b3:f1:c3)
        Address: IntelCor_b3:f1:c3 (a0:a8:cd:b3:f1:c3)
        .... ..0. .... .... .... .... = LG bit: Globally unique address (factory default)
        .... ...0 .... .... .... .... = IG bit: Individual address (unicast)
    Type: IPv4 (0x0800)
Internet Protocol Version 4, Src: 172.29.106.52, Dst: 128.119.245.12
    0100 .... = Version: 4
    .... 0101 = Header Length: 20 bytes (5)
    Differentiated Services Field: 0x00 (DSCP: CS0, ECN: Not-ECT)
        0000 00.. = Differentiated Services Codepoint: Default (0)
        .... ..00 = Explicit Congestion Notification: Not ECN-Capable Transport (0)
    Total Length: 52
    Identification: 0x8a24 (35364)
    Flags: 0x02 (Don't Fragment)
        0... .... = Reserved bit: Not set
        .1.. .... = Don't fragment: Set
        ..0. .... = More fragments: Not set
    Fragment offset: 0
    Time to live: 64
    Protocol: TCP (6)
    Header checksum: 0x24ca [validation disabled]
    [Header checksum status: Unverified]
    Source: 172.29.106.52
    Destination: 128.119.245.12
    [Source GeoIP: Unknown]
    [Destination GeoIP: United States]
        [Destination GeoIP Country: United States]
Transmission Control Protocol, Src Port: 37502, Dst Port: 80, Seq: 1, Ack: 1, Len: 0
    Source Port: 37502
    Destination Port: 80
    [Stream index: 3]
    [TCP Segment Len: 0]
    Sequence number: 1    (relative sequence number)
    Acknowledgment number: 1    (relative ack number)
    Header Length: 32 bytes
    Flags: 0x010 (ACK)
        000. .... .... = Reserved: Not set
        ...0 .... .... = Nonce: Not set
        .... 0... .... = Congestion Window Reduced (CWR): Not set
        .... .0.. .... = ECN-Echo: Not set
        .... ..0. .... = Urgent: Not set
        .... ...1 .... = Acknowledgment: Set
        .... .... 0... = Push: Not set
        .... .... .0.. = Reset: Not set
        .... .... ..0. = Syn: Not set
        .... .... ...0 = Fin: Not set
        [TCP Flags: ·······A····]
    Window size value: 229
    [Calculated window size: 29312]
    [Window size scaling factor: 128]
    Checksum: 0x339c [unverified]
    [Checksum Status: Unverified]
    Urgent pointer: 0
    Options: (12 bytes), No-Operation (NOP), No-Operation (NOP), Timestamps
        No-Operation (NOP)
            Type: 1
                0... .... = Copy on fragmentation: No
                .00. .... = Class: Control (0)
                ...0 0001 = Number: No-Operation (NOP) (1)
        No-Operation (NOP)
            Type: 1
                0... .... = Copy on fragmentation: No
                .00. .... = Class: Control (0)
                ...0 0001 = Number: No-Operation (NOP) (1)
        Timestamps: TSval 494771, TSecr 2851667115
            Kind: Time Stamp Option (8)
            Length: 10
            Timestamp value: 494771
            Timestamp echo reply: 2851667115
    [SEQ/ACK analysis]
        [This is an ACK to the segment in frame: 8]
        [The RTT to ACK the segment was: 0.000038993 seconds]
        [iRTT: 0.279732783 seconds]

No.     Time                          Source                Destination           Protocol Length Info
     10 2017-09-14 09:00:59.094285935 172.29.106.52         128.119.245.12        HTTP     633    GET /wireshark-labs/HTTP-wireshark-file1.html HTTP/1.1 

Frame 10: 633 bytes on wire (5064 bits), 633 bytes captured (5064 bits) on interface 0
    Interface id: 0 (wlan0)
    Encapsulation type: Ethernet (1)
    Arrival Time: Sep 14, 2017 09:00:59.094285935 BRT
    [Time shift for this packet: 0.000000000 seconds]
    Epoch Time: 1505390459.094285935 seconds
    [Time delta from previous captured frame: 0.000151438 seconds]
    [Time delta from previous displayed frame: 0.000000000 seconds]
    [Time since reference or first frame: 0.280047339 seconds]
    Frame Number: 10
    Frame Length: 633 bytes (5064 bits)
    Capture Length: 633 bytes (5064 bits)
    [Frame is marked: False]
    [Frame is ignored: False]
    [Protocols in frame: eth:ethertype:ip:tcp:http]
    [Coloring Rule Name: HTTP]
    [Coloring Rule String: http || tcp.port == 80 || http2]
Ethernet II, Src: IntelCor_b3:f1:c3 (a0:a8:cd:b3:f1:c3), Dst: PaloAlto_00:01:27 (00:1b:17:00:01:27)
    Destination: PaloAlto_00:01:27 (00:1b:17:00:01:27)
